CODI_CAPA,NOM_CAPA_CAT,NOM_CAPA_CAST,NOM_CAPA_ANG,COORD_X,COORD_Y,EQUIPAMENT,TELEFON,ADRECA
C003,Casals d'avis,Centros para la 3a edad,Senior citizens centres,431751.235,4581990.741,Associacio  de Funcionaris Jubilats de l' Administracio Local,933199096,Pg Born 17
C003,Casals d'avis,Centros para la 3a edad,Senior citizens centres,431763.359,4584731.797,Casal de Gent Gran de Sant Marti,934559803,C Xifre 41*47
C003,Casals d'avis,Centros para la 3a edad,Senior citizens centres,431879.982,4588726.196,Club Sant Jordi *Prosperitat,933599168,Pablo Iglesias 102
C003,Casals d'avis,Centros para la 3a edad,Senior citizens centres,431937.512,4582767.525,Casal de Gent Gran del Parc - Sandaru,933090635,C Buenaventura Munoz 21
C003,Casals d'avis,Centros para la 3a edad,Senior citizens centres,431993.522,4586212.814,Casal de Gent Gran La Palmera,933516755,C Olesa 41
C003,Casals d'avis,Centros para la 3a edad,Senior citizens centres,431999.628,4589024.839,Residencia Assistida per a Gent Gran La Trinitat Nova-Casal de Gent Gran Trinitat Nova,933535022,Fosca 4*8
C003,Casals d'avis,Centros para la 3a edad,Senior citizens centres,432031.413,4583349.923,Casal de Gent Gran Fort Pienc,null,C Ali Bei 120
C003,Casals d'avis,Centros para la 3a edad,Senior citizens centres,432175.086,4587692.406,Casal de Gent Gran Basconia,null,C Basconia 0042
C003,Casals d'avis,Centros para la 3a edad,Senior citizens centres,432188.194,4585987.373,Esplai de Gent Gran Meridiana,933408078,C Sant Antoni Maria Claret 474
C003,Casals d'avis,Centros para la 3a edad,Senior citizens centres,432204.706,4589097.224,Casal de Gent Gran Platja d'Aro,932760651,C Platja d'Aro 6
C003,Casals d'avis,Centros para la 3a edad,Senior citizens centres,432226.615,4588456.629,Casal de Gent Gran Mossen Clapes,933466372,C Gran de Sant Andreu 467
C003,Casals d'avis,Centros para la 3a edad,Senior citizens centres,432242.244,4581509.962,Casal de Gent Gran de la Barceloneta,932216716,Baluard 28
C003,Casals d'avis,Centros para la 3a edad,Senior citizens centres,432473.442,4586828.43,Casal de Gent Gran Sant Andreu,933111411,C Gran de Sant Andreu 20
C003,Casals d'avis,Centros para la 3a edad,Senior citizens centres,432542.24,4589263.421,Esplai de Gent Gran de la Trinitat Vella,933455738,C Mare Deu Lorda 2*10
C003,Casals d'avis,Centros para la 3a edad,Senior citizens centres,432548.922,4589213.108,Casal de Gent Gran Trinitat Vella,933454561,Madriguera 38*42
C003,Casals d'avis,Centros para la 3a edad,Senior citizens centres,432556.806,4581490.9,Espai de Gent Gran Mediterrania,932563320,C Conreria 0001
C003,Casals d'avis,Centros para la 3a edad,Senior citizens centres,432636.771,4584971.385,Casal de Gent Gran Joan Casanelles,934850324,C Concili de Trento 15
C003,Casals d'avis,Centros para la 3a edad,Senior citizens centres,432766.311,4585594.263,Associacio de Veins de Provencals la Verneda-Casal d'Avis Provencals,933074695,C Doctor Zamenhof 25
C003,Casals d'avis,Centros para la 3a edad,Senior citizens centres,432890.319,4585277.714,Casal de Gent Gran Bac de Roda,933081208,C Bac de Roda 190
C003,Casals d'avis,Centros para la 3a edad,Senior citizens centres,432961.115,4585975.28,Llar de Sant Marti de Provencals,933134609,Pl Ignasi Juliol 0001
C003,Casals d'avis,Centros para la 3a edad,Senior citizens centres,433118.071,4585522.192,Casal de Gent Gran de Sant Marti,933089793,C Selva de Mar 215
C003,Casals d'avis,Centros para la 3a edad,Senior citizens centres,433193.291,4589018.27,Casal de Gent Gran Baro de Viver,932742917,Pg Santa Coloma 104
C003,Casals d'avis,Centros para la 3a edad,Senior citizens centres,433283.427,4583822.066,Casal Ciber@ula Poblenou,934850596,Rbla Poblenou 75
C003,Casals d'avis,Centros para la 3a edad,Senior citizens centres,433288.794,4585537.992,Club Sant Jordi *La Verneda,933051703,Treball 213
C003,Casals d'avis,Centros para la 3a edad,Senior citizens centres,433341.251,4585935.912,Residencia Assistida per a Gent Gran La Verneda-Casal de Gent Gran Verneda,932780012,Cantabria 28
C003,Casals d'avis,Centros para la 3a edad,Senior citizens centres,433501.812,4587948.69,Casal de Gent Gran Bon Pastor,933115776,Pg Mollerussa 3
C003,Casals d'avis,Centros para la 3a edad,Senior citizens centres,433516.466,4583881.828,Casal de Gent Gran Taulat - Can Saladrigas,934852540,C Llull 0214
C003,Casals d'avis,Centros para la 3a edad,Senior citizens centres,433559.037,4584423.63,Casal de Gent Gran Quatre Cantons,933070674,Cami Antic de Valencia 96
C003,Casals d'avis,Centros para la 3a edad,Senior citizens centres,433619.349,4586472.893,Associacio de Veins de la Verneda Alta-Associacio Casal Gent Gran Verneda Alta,933051754,C Binefar 16*20
C003,Casals d'avis,Centros para la 3a edad,Senior citizens centres,433619.349,4586472.893,Casal d'Avis Verneda Alta,932781321,C Binefar 16
C003,Casals d'avis,Centros para la 3a edad,Senior citizens centres,433810.597,4585528.469,Casal de Gent Gran Paraguai-Peru,933051204,C Paraguai 11
C003,Casals d'avis,Centros para la 3a edad,Senior citizens centres,433902.329,4586131.538,Associacio de Veins del Barri de la La Pau-Casal d'Avis La Pau,933132899,Josep Estalella 3
C003,Casals d'avis,Centros para la 3a edad,Senior citizens centres,433960.238,4586237.006,Casal de Gent Gran de la Pau,932781287,Pl Pau 2
C003,Casals d'avis,Centros para la 3a edad,Senior citizens centres,434699.08,4585151.167,Casal de Gent Gran Joan Maragall,933130663,C Bermejo 1*5
C004,Casals de barri,Centros de barrio,Neighbourhood centres,424826.264,4587022.356,Casal de Barri Can Rectoret,932520849,C Via Lactia 4
C004,Casals de barri,Centros de barrio,Neighbourhood centres,425157.485,4582468.065,Casal de Barri de la Merce,null,Torrent de les Roses 41
C004,Casals de barri,Centros de barrio,Neighbourhood centres,428214.047,4579774.576,Casal de Barri El Polvori,null,C Iecla 1
C004,Casals de barri,Centros de barrio,Neighbourhood centres,428270.287,4578458.404,Centre de barri Eduard Aunos,932234331,C Tortosa 39
C004,Casals de barri,Centros de barrio,Neighbourhood centres,428314.576,4586026.184,Centre Comunitari de Penitents,934186871,C Veciana 2
C004,Casals de barri,Centros de barrio,Neighbourhood centres,428375.858,4579292.084,Associacio de Veins de La Vinya-Casal de Barri La Vinya,933314440,C Alts Forns 87
C004,Casals de barri,Centros de barrio,Neighbourhood centres,428700.878,4579392.351,Centre de Barri Can Clos,933311113,Pl Mig de Can Clos 7
C004,Casals de barri,Centros de barrio,Neighbourhood centres,428858.731,4582739.295,Centre d'Esplai Boix,655936375,C Londres 0064
C004,Casals de barri,Centros de barrio,Neighbourhood centres,429139.643,4584990.652,Casal de Barri La Miranda,932845532,Av Coll del Portell 74
C004,Casals de barri,Centros de barrio,Neighbourhood centres,429200.358,4587363.88,Casal de Barri Can Travi de la Vall d'Hebron,934289848,Av Cardenal Vidal Barraquer 45
C004,Casals de barri,Centros de barrio,Neighbourhood centres,429638.848,4584829.188,Casal de Barri Cardener,932100803,C Cardener 45
C004,Casals de barri,Centros de barrio,Neighbourhood centres,430097.876,4585614.717,Casal de Barri Can Baro-El Pirineu,932199224,C Josep Serrano 59*71
C004,Casals de barri,Centros de barrio,Neighbourhood centres,430149.777,4580764.381,Casal de joves Poble-sec,934413665,C Margarit 23
C004,Casals de barri,Centros de barrio,Neighbourhood centres,430212.131,4580686.849,Casal Elkano,null,C Elkano 24*26
C004,Casals de barri,Centros de barrio,Neighbourhood centres,430212.131,4580686.849,Coordinadora d'Entitats de Poble-sec-Casal Elkano,933299952,C Elkano 24*26
C004,Casals de barri,Centros de barrio,Neighbourhood centres,430340.545,4586400.95,Casal de Barri Font d'en Fargues,934205941,C Pedrell 67*69
C004,Casals de barri,Centros de barrio,Neighbourhood centres,430456.264,4581140.987,Casal de Barri Folch i Torres,933294295,C Reina Amalia 31*33
C004,Casals de barri,Centros de barrio,Neighbourhood centres,430584.808,4587442.081,Casal de Barri La Cosa Nostra,934201843,C Biure 1
C004,Casals de barri,Centros de barrio,Neighbourhood centres,431174.374,4588559.346,Casal de Barri Verdun,933547904,C Luz Casanova 4
C004,Casals de barri,Centros de barrio,Neighbourhood centres,431226.144,4582378.813,Centre Sant Pere Apostol,932682509,C Sant Pere Mes Alt 25
C004,Casals de barri,Centros de barrio,Neighbourhood centres,431422.944,4582378.575,Casal de Barri Pou de la Figuera,932690615,C Sant Pere Mes Baix 70
C004,Casals de barri,Centros de barrio,Neighbourhood centres,431525.922,4586354.243,Casal de Barri Congres-Indians,933513953,C Manigua 25*35
C004,Casals de barri,Centros de barrio,Neighbourhood centres,431553.711,4590096.805,Casal de Barri Torre Baro,933530358,Av Escolapi Cancer 35*37
C004,Casals de barri,Centros de barrio,Neighbourhood centres,431585.4,4588318.693,Casal de Barri de Prosperitat,933538644,Pl angel Pestana 1
C004,Casals de barri,Centros de barrio,Neighbourhood centres,431941.467,4585076.056,Espai Antonio Miro Peris,934507013,Pl Carme Monturiol 10
C004,Casals de barri,Centros de barrio,Neighbourhood centres,432055.787,4590767.048,Casal de Barri de Vallbona,933509381,C Orista 8*10
C004,Casals de barri,Centros de barrio,Neighbourhood centres,432768.437,4586942.069,Casal de Barri Can Portabella,null,C Virgili 26
C004,Casals de barri,Centros de barrio,Neighbourhood centres,432975.763,4586207.432,Casal de Barri Verneda,933057384,C Santander 6
C004,Casals de barri,Centros de barrio,Neighbourhood centres,433284.62,4583145.812,Casal de Barri Vila Olimpica-Can Gili Nou,932219522,C Taulat 3*5
C004,Casals de barri,Centros de barrio,Neighbourhood centres,433414.811,4583687.2,Casal de Barri del Poblenou,933091960,Rbla Poblenou 49
C004,Casals de barri,Centros de barrio,Neighbourhood centres,433451.504,4588923.266,Sala Jove de Baro de Viver,933456208,Pg Guayaquil 53*55
C004,Casals de barri,Centros de barrio,Neighbourhood centres,433559.037,4584423.63,Casal de Barri Bac de Roda - Poblenou,933032447,Cami Antic de Valencia 96*106
C004,Casals de barri,Centros de barrio,Neighbourhood centres,433747.526,4585956.307,Casal de Barri La Palmera,933053705,C Duoda 6*22
C004,Casals de barri,Centros de barrio,Neighbourhood centres,433992.429,4586195.879,Casal de Barri La Pau-Piramidon,932780535,Pere Verges 1
C004,Casals de barri,Centros de barrio,Neighbourhood centres,434104.061,4584551.92,Casal de Barri Diagonal Mar,934982446,C Selva de Mar 22*32
C004,Casals de barri,Centros de barrio,Neighbourhood centres,434481.781,4585560.658,Casal de Barri Besos,null,C Cristobal de Moura 230-232
C005,Casals infantils,Centros infantiles,Children's centres,425090.695,4585460.573,Centre Civic Vallvidrera Vazquez Montalban-Casal Infantil Vallvidrera,934069053,C Reis Catolics 16*34
C005,Casals infantils,Centros infantiles,Children's centres,426624.465,4583059.345,Centre Civic Sarria-Casal Infantil Sarria,932562720,Eduardo Conde 22*42
C005,Casals infantils,Centros infantiles,Children's centres,426795.171,4583747.576,Espai Infantil El petit Drac,932053002,Via Augusta 327
C005,Casals infantils,Centros infantiles,Children's centres,428551.453,4583966.051,Centre Civic Casa Sagnier-Casal Infantil Casa Sagnier,934140195,C Brusi 51*61
C005,Casals infantils,Centros infantiles,Children's centres,428610.769,4586232.613,Casal Infantil Teixonera,null,Arenys 75
C005,Casals infantils,Centros infantiles,Children's centres,429053.068,4585777.61,Centre Civic El Coll - La Bruguera-Casal Infantil El Coll,932562886,C Aldea 15
C005,Casals infantils,Centros infantiles,Children's centres,429081.677,4584591.223,Escola Rius i Taulet-Casal Infantil,647618814,Pl Lesseps 19
C005,Casals infantils,Centros infantiles,Children's centres,429146.3,4586789.583,Centre Juvenil Marti Codolar,934072330,Av Cardenal Vidal Barraquer 8-12
C005,Casals infantils,Centros infantiles,Children's centres,429196.976,4582255.292,Centre Cultural Teresa Pamies-Casal Infantil Urgell,934536480,C Comte d'Urgell 145*147
C005,Casals infantils,Centros infantiles,Children's centres,429298.158,4584170.592,Escola Reina Violant-Casal Infantil,934591228,C Trilla 18*20
C005,Casals infantils,Centros infantiles,Children's centres,429531.857,4586299.017,Casal Infantil La Torre,934291021,Conca de Tremp 22
C005,Casals infantils,Centros infantiles,Children's centres,429835.515,4585507.177,Casal Infantil l'anec,932847496,Pl Raimon Casellas 7
C005,Casals infantils,Centros infantiles,Children's centres,430116.639,4581029.541,Centre Civic Cotxeres Borrell-Casal Infantil Cotxeres Borrell,933248350,C Viladomat 2*8
C005,Casals infantils,Centros infantiles,Children's centres,430201.197,4588468.517,Casal Infantil Canyelles,934272667,C Miguel Hernandez 11
C005,Casals infantils,Centros infantiles,Children's centres,430253.105,4581233.444,Casal de Joves Calassanc,934417789,C Cera 46
C005,Casals infantils,Centros infantiles,Children's centres,430524.38,4584316.593,Centre Civic La Sedeta-Casal Infantil La Sedeta,932073613,C Sicilia 321
C005,Casals infantils,Centros infantiles,Children's centres,430595.025,4581426.074,Casal Infantil l'Estel d'Assis,934426534,Rbla Raval 7
C005,Casals infantils,Centros infantiles,Children's centres,430804.19,4585624.696,Centre Civic Guinardo-Casal Infantil Guinardo,935262784,C Genova 2
C005,Casals infantils,Centros infantiles,Children's centres,430812.88,4581449.587,Associacio Casal dels Infants Accio Social als Barris *Junta de Comerc,933170013,C Junta de Comerc 16
C005,Casals infantils,Centros infantiles,Children's centres,430927.521,4581215.209,Centre Civic Drassanes-Casal Infantil Drassanes,934412280,C Nou de la Rambla 43
C005,Casals infantils,Centros infantiles,Children's centres,430998.098,4588852.926,Casal Infantil Roquetes,932769811,C Alcantara 22*LB
C005,Casals infantils,Centros infantiles,Children's centres,431270.294,4584350.139,Centre Civic Sagrada Familia-Casal Infantil Sagrada Familia,934508917,C Provenca 480
C005,Casals infantils,Centros infantiles,Children's centres,431333.679,4581463.673,Centre Compartir,933184783,C Codols 10
C005,Casals infantils,Centros infantiles,Children's centres,431446.088,4581641.358,Casal Infantil Pati Llimona,932684700,C Regomir 3
C005,Casals infantils,Centros infantiles,Children's centres,431529.452,4590445.228,Casal Infantil Ciutat Meridiana,658325172,C Vallcivera 3
C005,Casals infantils,Centros infantiles,Children's centres,431678.75,4582289.597,Centre Civic Convent de Sant Agusti-Casal Infantil Convent Sant Agusti,932565000,C Comerc 36
C005,Casals infantils,Centros infantiles,Children's centres,431749.097,4583195.747,Centre Civic Ateneu Fort Pienc-Casal Infantil Fort Pienc,932327827,Pl Fort Pienc 4*5
C005,Casals infantils,Centros infantiles,Children's centres,431827.945,4590646.268,Casal Infantil Vallbona,933537898,C Pujalt 4
C005,Casals infantils,Centros infantiles,Children's centres,432008.799,4589315.698,Casal Infantil El Desvan,933534815,C Vila-real 7*9
C005,Casals infantils,Centros infantiles,Children's centres,432456.155,4585136.492,Escola Tecnica Professional del Clot-Centre d'Esplai Sant Pere Claver,933516011,C Valencia 680
C005,Casals infantils,Centros infantiles,Children's centres,432556.806,4581490.901,Casal Infantil Barceloneta,932563320,C Conreria 1*9
C005,Casals infantils,Centros infantiles,Children's centres,433118.065,4585522.198,Casal Infantil Sant Marti,932565782,C Selva de Mar 215
C005,Casals infantils,Centros infantiles,Children's centres,433264.446,4589048.176,Centre Civic Baro de Viver-Casal Infantil Baro de Viver,933457393,Pg Santa Coloma 110
C005,Casals infantils,Centros infantiles,Children's centres,433481.895,4587945.642,Casal Infantil Bon Pastor,933460079,C Mollerussa 1
C005,Casals infantils,Centros infantiles,Children's centres,433806.929,4586658.264,Casal Infantil El Drac,933135290,Via Trajana 18
C005,Casals infantils,Centros infantiles,Children's centres,434223.48,4585496.202,Casal Infantil El Vaixell,932663936,Rbla Prim 87*89
C006,Casals i espais per a joves,Centros juveniles,Young people centres,426624.465,4583059.345,Centre Civic Sarria-Espai Jove de Sarria,932562720,Eduardo Conde 22*42
C006,Casals i espais per a joves,Centros juveniles,Young people centres,426828.816,4581439.015,Espai d'Adolescents Bacardi,934489828,Trav Corts 94
C006,Casals i espais per a joves,Centros juveniles,Young people centres,427159.014,4581435.734,Centre Civic Joan Oliver - Pere Quart-Espai Jove,933398261,Comandant Benitez 6
C006,Casals i espais per a joves,Centros juveniles,Young people centres,427212.432,4582044.409,Centre Civic les Corts-Casal de Joves Les Corts,932 916 499,C Dolors Masferrer i Bosch 33*35
C006,Casals i espais per a joves,Centros juveniles,Young people centres,427574.98,4582396.673,Casal de joves de l'Olivera,null,C Anglesola 17 Bis
C006,Casals i espais per a joves,Centros juveniles,Young people centres,428519.393,4579086.338,La Bascula Espai Musical-Espai Jove,934 224 300,C Foc 128*132
C006,Casals i espais per a joves,Centros juveniles,Young people centres,428550.563,4583967.174,Centre Civic Casa Sagnier-Casal de Joves Casa Sagnier,934140195,C Brusi 51*61
C006,Casals i espais per a joves,Centros juveniles,Young people centres,429041.109,4585781.059,Centre Civic El Coll - La Bruguera-Casal de Joves del Coll,932562874,Duran i Borrell 24
C006,Casals i espais per a joves,Centros juveniles,Young people centres,429146.3,4586789.583,Centre Juvenil Marti Codolar,934072330,Av Cardenal Vidal Barraquer 8-12
C006,Casals i espais per a joves,Centros juveniles,Young people centres,429277.971,4584080.619,Espai Jove La Fontana,933681004,C Gran de Gracia 190*192
C006,Casals i espais per a joves,Centros juveniles,Young people centres,429521.861,4581319.884,Centre Juvenil Ixent,933257712,C Sepulveda 0067
C006,Casals i espais per a joves,Centros juveniles,Young people centres,429539.07,4582194.942,Associacio de Veins de l'Esquerra de L'Eixample-Casal de Joves Queix,934532879,Av Roma 139
C006,Casals i espais per a joves,Centros juveniles,Young people centres,429677.593,4581963.042,Centre Cristia dels Universitaris-Casal de Joves,933233368,C Villarroel 81
C006,Casals i espais per a joves,Centros juveniles,Young people centres,429769.493,4586336.718,Espai Jove Boca Nord,934299369,C Agudells 37*45
C006,Casals i espais per a joves,Centros juveniles,Young people centres,429820.687,4580672.36,Antena Infojove Poble-Sec - Espai Jove 12@16,933299918,C Concordia 35
C006,Casals i espais per a joves,Centros juveniles,Young people centres,430201.197,4588468.517,Casal Infantil Canyelles,934272667,C Miguel Hernandez 11
C006,Casals i espais per a joves,Centros juveniles,Young people centres,430253.105,4581233.444,Casal de Joves Calassanc,934417789,C Cera 46
C006,Casals i espais per a joves,Centros juveniles,Young people centres,430398.849,4587379.419,Associacio Can Ensenya Pro Persones amb Disminucio Psiquica-Club d'Oci,933582033,C Beret 81*83
C006,Casals i espais per a joves,Centros juveniles,Young people centres,430595.025,4581426.074,Casal Infantil l'Estel d'Assis,934426534,Rbla Raval 7
C006,Casals i espais per a joves,Centros juveniles,Young people centres,430601.113,4581056.372,Casal Sant Pau del Camp,934410001,C Sant Pau 101
C006,Casals i espais per a joves,Centros juveniles,Young people centres,430678.357,4587142.302,Espai Jove Les Basses,932563600,C Teide 20
C006,Casals i espais per a joves,Centros juveniles,Young people centres,430693.147,4587862.831,Casal de Joves Guineueta *Masia de la Guineueta,933594000,Pl Ca n'Ensenya 4
C006,Casals i espais per a joves,Centros juveniles,Young people centres,430812.876,4581449.593,Casal jove Atlas,933170013,C Junta de Comerc 16
C006,Casals i espais per a joves,Centros juveniles,Young people centres,430812.88,4581449.587,Associacio Casal dels Infants Accio Social als Barris *Junta de Comerc,933170013,C Junta de Comerc 16
C006,Casals i espais per a joves,Centros juveniles,Young people centres,430845.556,4581399.932,Casal de l'Estudiant,933013978,C Junta de Comerc 0026
C006,Casals i espais per a joves,Centros juveniles,Young people centres,430927.521,4581215.209,Centre Civic Drassanes-Casal de Joves Raval,934412280,C Nou de la Rambla 43
C006,Casals i espais per a joves,Centros juveniles,Young people centres,430927.521,4581215.209,Centre Civic Drassanes-Espai Jove,934412280,C Nou de la Rambla 43
C006,Casals i espais per a joves,Centros juveniles,Young people centres,431205.474,4582251.819,Casal Lambda-Grup de Joves,933195550,Verdaguer i Callis 10
C006,Casals i espais per a joves,Centros juveniles,Young people centres,431205.596,4588826.899,Casal de Joves Roquetes,932769271,C Vidal i Guasch 16
C006,Casals i espais per a joves,Centros juveniles,Young people centres,431333.679,4581463.673,Centre Compartir,933184783,C Codols 10
C006,Casals i espais per a joves,Centros juveniles,Young people centres,431373.306,4590316.903,Caritas Casal de Joves Llops de Taga,933541036,C Vallcivera 25
C006,Casals i espais per a joves,Centros juveniles,Young people centres,431413.386,4582381.096,Casal de Joves Palau Alos,932681224,C Sant Pere Mes Baix 55
C006,Casals i espais per a joves,Centros juveniles,Young people centres,431460.572,4581653.128,Centre Civic Pati Llimona-Servei de Dinamitzacio Juvenil - Franja del Gotic,932566100,C Regomir 3
C006,Casals i espais per a joves,Centros juveniles,Young people centres,431467.806,4581946.939,Viver d'Associacions Juvenils de Barcelona,901515253,C Princesa 6
C006,Casals i espais per a joves,Centros juveniles,Young people centres,431504.604,4585067.171,Casal Calassanc-Casal de Joves,934553104,C Sant Quinti 19
C006,Casals i espais per a joves,Centros juveniles,Young people centres,431678.75,4582289.597,Centre Civic Convent de Sant Agusti-Casal Infantil Convent Sant Agusti,932565000,C Comerc 36
C006,Casals i espais per a joves,Centros juveniles,Young people centres,431825.994,4588125.622,Casal de Joves Prosperitat,933505938,Av Rio de Janeiro 100
C006,Casals i espais per a joves,Centros juveniles,Young people centres,431827.945,4590646.268,Casal Infantil Vallbona,933537898,C Pujalt 4
C006,Casals i espais per a joves,Centros juveniles,Young people centres,432015.092,4585238.45,Fundacio Ginesta-Casal Joves Estrafularis,933473570,Sospir 0030
C006,Casals i espais per a joves,Centros juveniles,Young people centres,432021.517,4583359.206,Casal de Joves Xiroc,932230613,C Ali Bei 120
C006,Casals i espais per a joves,Centros juveniles,Young people centres,432031.413,4583349.923,Espai Jove de l'Eixample,null,C Ali Bei 120
C006,Casals i espais per a joves,Centros juveniles,Young people centres,432070.255,4585738.438,Centre Parroquial Sant Joan Bosco-Centre Juvenil Meridiana,934082910,Pl Ferran Reyes 0002
C006,Casals i espais per a joves,Centros juveniles,Young people centres,432092.198,4586195.766,Centre Garcilaso-Espai Jove,932562959,C Garcilaso 103
C006,Casals i espais per a joves,Centros juveniles,Young people centres,432456.155,4585136.492,Escola Tecnica Professional del Clot-Centre d'Esplai Sant Pere Claver,933516011,C Valencia 680
C006,Casals i espais per a joves,Centros juveniles,Young people centres,432527.156,4589260.898,Centre Joventut Santissima Trinitat,933451728,C Mare Deu Lorda 0001
C006,Casals i espais per a joves,Centros juveniles,Young people centres,432642.538,4587405.639,Centre Juvenil Sant Andreu,933118060,C Segre 0035
C006,Casals i espais per a joves,Centros juveniles,Young people centres,433264.446,4589048.176,Centre Civic Baro de Viver-Casal Infantil Baro de Viver,933457393,Pg Santa Coloma 110
C006,Casals i espais per a joves,Centros juveniles,Young people centres,433264.446,4589048.176,Centre Civic Baro de Viver-Servei de Dinamitzacio Juvenil Franja Besos,933457393,Pg Santa Coloma 110
C006,Casals i espais per a joves,Centros juveniles,Young people centres,434223.48,4585496.202,Casal Infantil El Vaixell,932663936,Rbla Prim 87*89
C007,Centres civics,Centros civicos,Civic centres,424850.011,4586084.275,Centre Civic l'Electric,932054009,Ctra Vallvidrera Planes 6.5 (km)
C007,Centres civics,Centros civicos,Civic centres,425090.695,4585460.573,Centre Civic Vallvidrera Vazquez Montalban,934069053,C Reis Catolics 16*34
C007,Centres civics,Centros civicos,Civic centres,426624.465,4583059.345,Centre Civic Sarria,932562720,C Eduardo Conde 22*42
C007,Centres civics,Centros civicos,Civic centres,426655.835,4581271.761,Centre Civic Riera Blanca,934480499,Rier Blanca 1*3
C007,Centres civics,Centros civicos,Civic centres,426920.791,4583550.856,Centre Civic Casa Orlandai,932524262,C Jaume Piquet 23
C007,Centres civics,Centros civicos,Civic centres,427159.014,4581435.734,Centre Civic Joan Oliver - Pere Quart,933398261,Comandant Benitez 6
C007,Centres civics,Centros civicos,Civic centres,427212.432,4582044.409,Centre Civic les Corts,932916462,C Dolors Masferrer i Bosch 33*35
C007,Centres civics,Centros civicos,Civic centres,427481.947,4584083.603,Centre Civic Pere Pruna,934186537,C Ganduxer 130
C007,Centres civics,Centros civicos,Civic centres,427564.125,4582260.202,Centre Civic Can Deu,934101007,Pl Concordia 13
C007,Centres civics,Centros civicos,Civic centres,427817.751,4584319.659,Centre Civic Villa Florida,932546265,C Muntaner 544
C007,Centres civics,Centros civicos,Civic centres,427917.296,4580980.321,Centre Civic Cotxeres de Sants,932918701,C Sants 79*83
C007,Centres civics,Centros civicos,Civic centres,427953.042,4586677.169,Centre Civic Casa Groga,934186531,Av Jorda 27
C007,Centres civics,Centros civicos,Civic centres,427982.343,4579390.503,Centre Pepita Casanellas-La Sala,932563730,Pg Zona Franca 185*219
C007,Centres civics,Centros civicos,Civic centres,428088.274,4579745.299,Centre Civic La Cadena,933313498,C Mare de Deu de Port 397
C007,Centres civics,Centros civicos,Civic centres,428217.893,4583613.425,Centre Civic Can Castello,932417874,C Castello 1*7
C007,Centres civics,Centros civicos,Civic centres,428274.815,4579008.834,Centre Civic Casa del Rellotge,934322489,Pg Zona Franca 116
C007,Centres civics,Centros civicos,Civic centres,428276.122,4580373.957,Casal Civic  Estacio de Magoria,934324801,G.V. Corts Catalanes 247
